{
  "id": "V2-E02-S05",
  "event_id": "V2-E02",
  "sequence": 5,
  "objective": "리안이 자신이 인간이 아니라 위원회가 만든 도구였다는 사실을 완전히 깨닫고 무너진다.",
  "previous_scene_id": "V2-E02-S04",
  "start_state": {
    "rian": "자신의 신체가 기억을 보존하기 위한 '그릇'으로 설계되었음을 알게 됨"
  },
  "end_state": {
    "rian": "자아의 근간이 흔들리는 극심한 정체성 붕괴를 겪음"
  },
  "owns": {
    "changes": [
      "EL_Vessel_Awareness"
    ],
    "setups": [],
    "payoffs": []
  },
  "consumes_setups": [
    "EL_Librarian_Fate"
  ],
  "target_chars": 4800
}
