{
  "id": "V1-E01-S01",
  "event_id": "V1-E01",
  "sequence": 1,
  "objective": "에테르노의 거대한 성벽과 '제국의 눈'이 주는 압도적인 감시 분위기를 묘사한다.",
  "previous_scene_id": null,
  "start_state": {
    "mood": "압도적",
    "danger": "높음"
  },
  "end_state": {
    "mood": "긴장",
    "danger": "매우 높음"
  },
  "owns": {
    "changes": [],
    "setups": [],
    "payoffs": []
  },
  "consumes_setups": [],
  "target_chars": 3000
}
