{
  "id": "V1-E03-S06",
  "event_id": "V1-E03",
  "sequence": 6,
  "objective": "어둠 속에서 마주한 정체불명의 지하 생명체 혹은 수호자와의 짧지만 강렬한 교전을 묘사한다.",
  "previous_scene_id": "V1-E03-S05",
  "start_state": {
    "mood": "지침",
    "danger": "높음"
  },
  "end_state": {
    "mood": "긴장",
    "danger": "매우 높음"
  },
  "owns": {
    "changes": [],
    "setups": [],
    "payoffs": []
  },
  "consumes_setups": [],
  "target_chars": 3000
}
