{
  "id": "V4-E02-S02",
  "event_id": "V4-E02",
  "sequence": 2,
  "objective": "설원에서의 은신과 추격자와의 숨막히는 심리전",
  "previous_scene_id": "V4-E02-S01",
  "start_state": {
    "status": "추격 인지"
  },
  "end_state": {
    "status": "은신 유지"
  },
  "owns": {
    "changes": [],
    "setups": [],
    "payoffs": []
  },
  "consumes_setups": [],
  "target_chars": 4000
}
