{
  "id": "V4-E03-S05",
  "event_id": "V4-E03",
  "sequence": 5,
  "objective": "리안이 절망하는 엘라라를 위로하며, 제단으로 가지 않고 다른 방법을 찾겠다고 다짐하는 장면을 묘사한다.",
  "previous_scene_id": "V4-E03-S04",
  "start_state": {
    "elara": "자신의 존재 이유가 결국 거대한 쓰레기통이자 제물이었다는 사실에 절망함"
  },
  "end_state": {
    "world": "모든 슬픔을 흡수해 격리할 사서의 필요성이 입증됨"
  },
  "owns": {
    "changes": [],
    "setups": [],
    "payoffs": []
  },
  "consumes_setups": [],
  "target_chars": 4000
}
