{
  "id": "V4-E03-S03",
  "event_id": "V4-E03",
  "sequence": 3,
  "objective": "카엘이 기사단의 정석 검술로 공격하지만 모두 읽히고 반격당함",
  "previous_scene_id": "V4-E03-S02",
  "start_state": {
    "status": "방어막의 벽 체감"
  },
  "end_state": {
    "status": "전술적 패배"
  },
  "owns": {
    "changes": [],
    "setups": [],
    "payoffs": []
  },
  "consumes_setups": [],
  "target_chars": 4000
}
