{
  "id": "V5-E03-S02",
  "event_id": "V5-E03",
  "sequence": 2,
  "objective": "도시 전역에 설치된 '제국의 눈' 감시망의 작동 원리를 파악하고 사각지대를 이용해 이동한다.",
  "previous_scene_id": "V5-E03-S01",
  "start_state": {
    "status": "빈민가 잠입"
  },
  "end_state": {
    "status": "궁전 외곽 접근"
  },
  "owns": {
    "changes": [],
    "setups": [],
    "payoffs": []
  },
  "consumes_setups": [],
  "target_chars": 3000
}
