{
  "id": "V2-E04-S08",
  "event_id": "V2-E04",
  "sequence": 8,
  "objective": "기억에서 깨어난 카엘이 발타자르를 반드시 무너뜨리겠다는 강렬한 증오와 결의를 다지며 마무리한다.",
  "previous_scene_id": "V2-E04-S07",
  "start_state": {
    "status": "진실 목격"
  },
  "end_state": {
    "status": "증오와 결의"
  },
  "owns": {
    "changes": [],
    "setups": [],
    "payoffs": []
  },
  "consumes_setups": [],
  "target_chars": 3500
}
