{
  "id": "V4-E02-S06",
  "event_id": "V4-E02",
  "sequence": 6,
  "objective": "성소의 최종 관문인 거대 석문에 도달하여 진입 준비",
  "previous_scene_id": "V4-E02-S05",
  "start_state": {
    "status": "결의 다짐"
  },
  "end_state": {
    "status": "최종 관문 진입"
  },
  "owns": {
    "changes": [],
    "setups": [],
    "payoffs": []
  },
  "consumes_setups": [],
  "target_chars": 4000
}
